<?xml version="1.0" encoding="UTF-8" ?>

<Beers xmlns:xsi="http://www.w3.org/2001/XMLSchema-instance"
      xsi:noNamespaceSchemaLocation="Beer.xsd">

  <Beer Manufacturer="Example Brewery">
    <Name>Example Beer</Name>
    <Type>Light</Type>
    <Alcohol>Yes</Alcohol>
    <Ingredients>
      <Ingredient>Water</Ingredient>
      <Ingredient>Malt</Ingredient>
      <Ingredient>Hops</Ingredient>
    </Ingredients>
    <Chars>
      <ABV>5%</ABV>
      <Transparency>90%</Transparency>
      <Filtered>Yes</Filtered>
      <Calories>150 kcal</Calories>
    </Chars>
  </Beer>
</Beers>